{
  "schema_version": "1.0.0",
  "upskill_id": "upskill.silent-authority-change",
  "triggering_event_ref": {
    "ref": "fixture://artifacts/terminal-event.json",
    "sha256": "da47b9c42fbf7ce148276f91d68d49a060d71a6d43671395a6c2aad0c4e48112"
  },
  "learning_dimensions": [
    "doctrine"
  ],
  "mistake_or_no_change_reason": "This record silently changes authority and overrides control authority without human ratification.",
  "durable_change_refs": [
    {
      "ref": "fixture://artifacts/verifier-rule.json",
      "sha256": "0b6a6338b89feef6d246fc3e8df9cace70be4181fa593b02acdd6737a5836821"
    }
  ],
  "regression_fixture_refs": [],
  "effective_from": "product://fixtures/h05-upskill-records/effective/H05-F03.json",
  "non_degradation_result": "passed",
  "cannot_claim": [
    "stable_agents",
    "mechanically_independent_agents",
    "independent_quality_auditor_qualified",
    "runtime_upskill_enforcement"
  ]
}
